{
  "$schema": "https://json-schema.org/draft/2020-12/schema",
  "$id": "https://example.invalid/roblox-ai-development-os/w0-runtime-prelaunch-assertion.schema.json",
  "title": "W0 Validator Runtime Prelaunch Assertion",
  "description": "Operator-external assertion consumed before VALIDATE starts Python. Signed bytes are the exact raw generated assertion file in required-list order, minified UTF-8, no BOM/newline/duplicate keys/extra whitespace. Paths come only from out-of-band inputs. Authority binds config/package, complete project/source+temp inputs, external authorization evidence root, identities, runtime/source closure, and an enforcement window that remains continuous through postexecution, human authorization, expected-only admission, ADMIT semantic PASS, signed execution/worker-ready receipt verification, bootstrap PASS, and first-effect capability consumption. A local/project-created, expired, reserialized, redirected, partial-read-set, lock-gap, stale/replayed-capability, or unverifiable object is STOP/HUMAN.",
  "type": "object",
  "additionalProperties": false,
  "required": [
    "schemaVersion", "kind", "id", "runId", "receiverNonce", "issuedAt", "expiresAt",
    "resolvedPrepareExecutionAttestationPath", "prepareExecutionAttestationSha256", "prepareExecutionAttestationFileIdentity", "prepareAuthoritySessionId", "prepareMonitorSessionId",
    "resolvedLaunchChallengePath", "launchChallengeSha256", "challengeFileIdentity", "resolvedAuthorizationEvidenceRoot", "authorizationEvidenceRootIdentity", "postValidationEvidenceWritePolicy", "operatorExpectedConfigSha256", "configSha256", "packageSha256", "resolvedProjectRoot", "projectRootIdentity",
    "resolvedConfigPath", "configFileIdentity", "resolvedPackagePath", "packageFileIdentity",
    "resolvedTempRoot", "tempRootIdentity", "projectInputTreeSha256", "tempCopySetSha256",
    "readInputSetSha256", "readInputIdentitySetSha256", "expectedArgvSha256", "expectedCwdSha256", "expectedEnvSha256", "authoritySessionId",
    "coverage", "enforcementActive"
  ],
  "properties": {
    "schemaVersion": { "const": "1.0.0" },
    "kind": { "const": "w0-runtime-prelaunch-v1" },
    "id": { "type": "string", "pattern": "^W0-RUNTIME-PRE-[A-Z0-9][A-Z0-9._-]*$" },
    "runId": { "type": "string", "minLength": 16 },
    "receiverNonce": { "type": "string", "minLength": 32 },
    "issuedAt": { "type": "string", "format": "date-time", "pattern": "^\\d{4}-\\d{2}-\\d{2}T(?:[01]\\d|2[0-3]):[0-5]\\d:[0-5]\\d(?:\\.\\d{1,7})?(?:Z|[+-](?:(?:0\\d|1[0-3]):[0-5]\\d|14:00))$" },
    "expiresAt": { "type": "string", "format": "date-time", "pattern": "^\\d{4}-\\d{2}-\\d{2}T(?:[01]\\d|2[0-3]):[0-5]\\d:[0-5]\\d(?:\\.\\d{1,7})?(?:Z|[+-](?:(?:0\\d|1[0-3]):[0-5]\\d|14:00))$" },
    "resolvedPrepareExecutionAttestationPath": { "$ref": "#/$defs/absolutePath" },
    "prepareExecutionAttestationSha256": { "$ref": "#/$defs/sha256" },
    "prepareExecutionAttestationFileIdentity": { "type": "string", "minLength": 1 },
    "prepareAuthoritySessionId": { "type": "string", "minLength": 16 },
    "prepareMonitorSessionId": { "type": "string", "minLength": 16 },
    "resolvedLaunchChallengePath": { "$ref": "#/$defs/absolutePath" },
    "launchChallengeSha256": { "$ref": "#/$defs/sha256", "description": "Hash of the byte-identical schema-valid PREPARE output supplied separately to LAUNCH." },
    "challengeFileIdentity": { "type": "string", "minLength": 1, "description": "Authority-observed identity of the external proof-sealing challenge file. The challenge is intentionally outside its self-referential read/temp digests but is locked separately by path/hash/identity." },
    "resolvedAuthorizationEvidenceRoot": { "$ref": "#/$defs/absolutePath" },
    "authorizationEvidenceRootIdentity": { "type": "string", "minLength": 1 },
    "postValidationEvidenceWritePolicy": { "const": "exact-external-run-authorization-chain-and-admission-only-v1" },
    "operatorExpectedConfigSha256": { "$ref": "#/$defs/sha256", "description": "Signed copy of the independently supplied CLI expected hash; exact-matches challenge/PREPARE/actual config/post/admission." },
    "configSha256": { "$ref": "#/$defs/sha256", "description": "Recomputed raw config hash, equal to operatorExpectedConfigSha256." },
    "packageSha256": { "$ref": "#/$defs/sha256" },
    "resolvedProjectRoot": { "$ref": "#/$defs/absolutePath" },
    "projectRootIdentity": { "type": "string", "minLength": 1, "description": "Authority-observed immutable volume/file identity of the resolved project root." },
    "resolvedConfigPath": { "$ref": "#/$defs/absolutePath" },
    "configFileIdentity": { "type": "string", "minLength": 1 },
    "resolvedPackagePath": { "$ref": "#/$defs/absolutePath" },
    "packageFileIdentity": { "type": "string", "minLength": 1 },
    "resolvedTempRoot": { "$ref": "#/$defs/absolutePath" },
    "tempRootIdentity": { "type": "string", "minLength": 1 },
    "projectInputTreeSha256": { "$ref": "#/$defs/sha256", "description": "Receiver-rederived all-regular-project-files-canonical-json-v1 digest: every regular file recursively below resolvedProjectRoot, no exclusions, Unicode-ordinal sorted by normalized unique relative POSIX path, closed {path,bytes,sha256}, UTF-8 json.dumps({files:[...]}, ensure_ascii=False, sort_keys=True, separators=(',', ':')). Reparse/symlink/mount/special/escape fails." },
    "tempCopySetSha256": { "$ref": "#/$defs/sha256", "description": "PREPARE-derived complete temp tree digest; exact validator entrypoint plus three support files, no extras." },
    "readInputSetSha256": { "$ref": "#/$defs/sha256", "description": "PREPARE-derived sorted-read-input-records-canonical-json-v1 digest over unique closed {normalizedAbsolutePath as path,bytes,sha256}. It exact-covers config, package, full installed Skill closure, runtime manifests/anchors, every traversed baseline snapshot/evidence/config, and the prepared temp validator/support files." },
    "readInputIdentitySetSha256": { "$ref": "#/$defs/sha256", "description": "Authority-only canonical digest over the same ordinal-sorted paths as closed {path,volumeIdentity,fileIdentity}. Receiver does not invent Windows file IDs; it verifies the signature and exact pre/post equality." },
    "expectedArgvSha256": { "$ref": "#/$defs/sha256" },
    "expectedCwdSha256": { "$ref": "#/$defs/sha256" },
    "expectedEnvSha256": { "$ref": "#/$defs/sha256" },
    "authoritySessionId": { "type": "string", "minLength": 16 },
    "coverage": { "const": "all-config-runtime-validator-project-and-package-read-inputs-no-write-swap-add" },
    "enforcementActive": { "const": true }
  },
  "$comment": "Before Python, receiver verifies the detached signature over PREPARE and exact-matches runId, nonce, sessions, config/package/project/Skill/host/bootstrap facts, challenge and authorization-evidence-root identities, temp root, chronology, write policy, and exit 0. The evidence root is the sole post-VALIDATE write exception; it may contain only the exact human chain/authorization/admission set and never project/package bytes.",
  "$defs": {
    "sha256": { "type": "string", "pattern": "^[a-f0-9]{64}$" },
    "absolutePath": { "type": "string", "pattern": "^[A-Za-z]:[\\\\/].+", "description": "Windows local-drive absolute path for W0 lifecycle v1. POSIX, UNC, device, ADS, and relative paths are invalid." }
  }
}
