{
  "schemaVersion": "1.0.0",
  "kind": "w0-runtime-prelaunch-v1",
  "id": "W0-RUNTIME-PRE-{{RUN_ID}}",
  "runId": "{{UNIQUE_W0_VALIDATOR_RUN_ID}}",
  "receiverNonce": "{{BOOTSTRAP_CRYPTOGRAPHIC_NONCE}}",
  "issuedAt": "{{AUTHORITY_ISSUED_AT}}",
  "expiresAt": "{{SHORT_EXPIRY_AT}}",
  "resolvedPrepareExecutionAttestationPath": "{{ABSOLUTE_OPERATOR_EXTERNAL_PREPARE_ATTESTATION_PATH}}",
  "prepareExecutionAttestationSha256": "{{PREPARE_EXECUTION_ATTESTATION_SHA256}}",
  "prepareExecutionAttestationFileIdentity": "{{AUTHORITY_OBSERVED_PREPARE_ATTESTATION_FILE_IDENTITY}}",
  "prepareAuthoritySessionId": "{{TRUSTED_RUNTIME_AUTHORITY_SESSION_ID}}",
  "prepareMonitorSessionId": "{{PREPARE_MONITOR_SESSION_ID}}",
  "resolvedLaunchChallengePath": "{{OPERATOR_EXTERNAL_PREDECLARED_LAUNCH_CHALLENGE_PATH}}",
  "launchChallengeSha256": "{{W0_RUNTIME_LAUNCH_CHALLENGE_SHA256}}",
  "challengeFileIdentity": "{{AUTHORITY_OBSERVED_CHALLENGE_FILE_IDENTITY}}",
  "resolvedAuthorizationEvidenceRoot": "{{OPERATOR_EXTERNAL_PREDECLARED_RUN_AUTHORIZATION_ROOT}}",
  "authorizationEvidenceRootIdentity": "{{AUTHORITY_OBSERVED_RUN_AUTHORIZATION_ROOT_IDENTITY}}",
  "postValidationEvidenceWritePolicy": "exact-external-run-authorization-chain-and-admission-only-v1",
  "operatorExpectedConfigSha256": "{{OUT_OF_BAND_OPERATOR_EXPECTED_CONFIG_SHA256}}",
  "configSha256": "{{OPERATOR_CONFIG_SHA256}}",
  "packageSha256": "{{W0_PACKAGE_SHA256}}",
  "resolvedProjectRoot": "{{ABSOLUTE_RECEIVER_RESOLVED_PROJECT_ROOT}}",
  "projectRootIdentity": "{{AUTHORITY_OBSERVED_PROJECT_ROOT_VOLUME_FILE_IDENTITY}}",
  "resolvedConfigPath": "{{ABSOLUTE_RECEIVER_RESOLVED_OPERATOR_CONFIG_PATH}}",
  "configFileIdentity": "{{AUTHORITY_OBSERVED_CONFIG_FILE_IDENTITY}}",
  "resolvedPackagePath": "{{ABSOLUTE_RECEIVER_RESOLVED_W0_PACKAGE_PATH}}",
  "packageFileIdentity": "{{AUTHORITY_OBSERVED_PACKAGE_FILE_IDENTITY}}",
  "resolvedTempRoot": "{{ABSOLUTE_BOOTSTRAP_FRESH_TEMP_ROOT}}",
  "tempRootIdentity": "{{AUTHORITY_OBSERVED_TEMP_ROOT_IDENTITY}}",
  "projectInputTreeSha256": "{{BOOTSTRAP_COMPLETE_PROJECT_INPUT_TREE_SHA256}}",
  "tempCopySetSha256": "{{BOOTSTRAP_TEMP_COPY_SET_SHA256}}",
  "readInputSetSha256": "{{BOOTSTRAP_COMPLETE_SOURCE_AND_TEMP_READ_INPUT_SET_SHA256}}",
  "readInputIdentitySetSha256": "{{AUTHORITY_OBSERVED_READ_INPUT_IDENTITY_SET_SHA256}}",
  "expectedArgvSha256": "{{BOOTSTRAP_EXPECTED_ARGV_SHA256}}",
  "expectedCwdSha256": "{{BOOTSTRAP_EXPECTED_CWD_SHA256}}",
  "expectedEnvSha256": "{{BOOTSTRAP_EXPECTED_ENV_SHA256}}",
  "authoritySessionId": "{{TRUSTED_RUNTIME_AUTHORITY_SESSION_ID}}",
  "coverage": "all-config-runtime-validator-project-and-package-read-inputs-no-write-swap-add",
  "enforcementActive": true
}
